<anim ver="netanim-3.108" filetype="animation" >
<node id="0" sysId="0" locX="0" locY="5" />
<node id="1" sysId="0" locX="2" locY="5" />
<node id="2" sysId="0" locX="6" locY="1" />
<node id="3" sysId="0" locX="6" locY="3.66" />
<node id="4" sysId="0" locX="6" locY="6.32" />
<node id="5" sysId="0" locX="6" locY="8.98" />
<node id="6" sysId="0" locX="10" locY="5" />
<node id="7" sysId="0" locX="14" locY="1" />
<node id="8" sysId="0" locX="14" locY="3.66" />
<node id="9" sysId="0" locX="14" locY="6.32" />
<node id="10" sysId="0" locX="14" locY="8.98" />
<node id="11" sysId="0" locX="18" locY="5" />
<node id="12" sysId="0" locX="20" locY="5" />
<nu p="c" t="0" id="0" r="255" g="0" b="0" />
<nu p="c" t="0" id="1" r="255" g="0" b="0" />
<nu p="c" t="0" id="2" r="255" g="0" b="0" />
<nu p="c" t="0" id="3" r="255" g="0" b="0" />
<nu p="c" t="0" id="4" r="255" g="0" b="0" />
<nu p="c" t="0" id="5" r="255" g="0" b="0" />
<nu p="c" t="0" id="6" r="255" g="0" b="0" />
<nu p="c" t="0" id="7" r="255" g="0" b="0" />
<nu p="c" t="0" id="8" r="255" g="0" b="0" />
<nu p="c" t="0" id="9" r="255" g="0" b="0" />
<nu p="c" t="0" id="10" r="255" g="0" b="0" />
<nu p="c" t="0" id="11" r="255" g="0" b="0" />
<nu p="c" t="0" id="12" r="255" g="0" b="0" />
<link fromId="0" toId="1" fd="10.0.1.1~00:00:00:00:00:01" td="10.0.1.2~00:00:00:00:00:02" ld="" />
<nonp2plinkproperties id="0" ipAddress="127.0.0.1~00:00:00:00:00:00" channelType="Unknown channel" />
<link fromId="1" toId="2" fd="10.0.2.1~00:00:00:00:00:03" td="10.0.2.2~00:00:00:00:00:04" ld="" />
<link fromId="1" toId="3" fd="10.0.3.1~00:00:00:00:00:05" td="10.0.3.2~00:00:00:00:00:06" ld="" />
<link fromId="1" toId="4" fd="10.0.4.1~00:00:00:00:00:07" td="10.0.4.2~00:00:00:00:00:08" ld="" />
<link fromId="1" toId="5" fd="10.0.5.1~00:00:00:00:00:09" td="10.0.5.2~00:00:00:00:00:0a" ld="" />
<nonp2plinkproperties id="1" ipAddress="127.0.0.1~00:00:00:00:00:00" channelType="Unknown channel" />
<link fromId="2" toId="6" fd="10.0.6.1~00:00:00:00:00:0b" td="10.0.6.2~00:00:00:00:00:0c" ld="" />
<nonp2plinkproperties id="2" ipAddress="127.0.0.1~00:00:00:00:00:00" channelType="Unknown channel" />
<link fromId="3" toId="6" fd="10.0.7.1~00:00:00:00:00:0d" td="10.0.7.2~00:00:00:00:00:0e" ld="" />
<nonp2plinkproperties id="3" ipAddress="127.0.0.1~00:00:00:00:00:00" channelType="Unknown channel" />
<link fromId="4" toId="6" fd="10.0.8.1~00:00:00:00:00:0f" td="10.0.8.2~00:00:00:00:00:10" ld="" />
<nonp2plinkproperties id="4" ipAddress="127.0.0.1~00:00:00:00:00:00" channelType="Unknown channel" />
<link fromId="5" toId="6" fd="10.0.9.1~00:00:00:00:00:11" td="10.0.9.2~00:00:00:00:00:12" ld="" />
<nonp2plinkproperties id="5" ipAddress="127.0.0.1~00:00:00:00:00:00" channelType="Unknown channel" />
<link fromId="6" toId="7" fd="10.0.10.1~00:00:00:00:00:13" td="10.0.10.2~00:00:00:00:00:14" ld="" />
<link fromId="6" toId="8" fd="10.0.11.1~00:00:00:00:00:15" td="10.0.11.2~00:00:00:00:00:16" ld="" />
<link fromId="6" toId="9" fd="10.0.12.1~00:00:00:00:00:17" td="10.0.12.2~00:00:00:00:00:18" ld="" />
<link fromId="6" toId="10" fd="10.0.13.1~00:00:00:00:00:19" td="10.0.13.2~00:00:00:00:00:1a" ld="" />
<nonp2plinkproperties id="6" ipAddress="127.0.0.1~00:00:00:00:00:00" channelType="Unknown channel" />
<link fromId="7" toId="11" fd="10.0.14.1~00:00:00:00:00:1b" td="10.0.14.2~00:00:00:00:00:1c" ld="" />
<nonp2plinkproperties id="7" ipAddress="127.0.0.1~00:00:00:00:00:00" channelType="Unknown channel" />
<link fromId="8" toId="11" fd="10.0.15.1~00:00:00:00:00:1d" td="10.0.15.2~00:00:00:00:00:1e" ld="" />
<nonp2plinkproperties id="8" ipAddress="127.0.0.1~00:00:00:00:00:00" channelType="Unknown channel" />
<link fromId="9" toId="11" fd="10.0.16.1~00:00:00:00:00:1f" td="10.0.16.2~00:00:00:00:00:20" ld="" />
<nonp2plinkproperties id="9" ipAddress="127.0.0.1~00:00:00:00:00:00" channelType="Unknown channel" />
<link fromId="10" toId="11" fd="10.0.17.1~00:00:00:00:00:21" td="10.0.17.2~00:00:00:00:00:22" ld="" />
<nonp2plinkproperties id="10" ipAddress="127.0.0.1~00:00:00:00:00:00" channelType="Unknown channel" />
<link fromId="11" toId="12" fd="10.0.18.1~00:00:00:00:00:23" td="10.0.18.2~00:00:00:00:00:24" ld="" />
<nonp2plinkproperties id="11" ipAddress="127.0.0.1~00:00:00:00:00:00" channelType="Unknown channel" />
<nonp2plinkproperties id="12" ipAddress="127.0.0.1~00:00:00:00:00:00" channelType="Unknown channel" />
<ip n="0" >
<address >10.0.1.1</address>

<address >127.0.0.1</address>

</ip>
<ip n="0" >
<address >10.0.1.1</address>

<address >127.0.0.1</address>

</ip>
<ip n="1" >
<address >10.0.1.2</address>

<address >10.0.2.1</address>

<address >10.0.3.1</address>

<address >10.0.4.1</address>

<address >10.0.5.1</address>

<address >127.0.0.1</address>

</ip>
<ip n="1" >
<address >10.0.1.2</address>

<address >10.0.2.1</address>

<address >10.0.3.1</address>

<address >10.0.4.1</address>

<address >10.0.5.1</address>

<address >127.0.0.1</address>

</ip>
<ip n="1" >
<address >10.0.1.2</address>

<address >10.0.2.1</address>

<address >10.0.3.1</address>

<address >10.0.4.1</address>

<address >10.0.5.1</address>

<address >127.0.0.1</address>

</ip>
<ip n="1" >
<address >10.0.1.2</address>

<address >10.0.2.1</address>

<address >10.0.3.1</address>

<address >10.0.4.1</address>

<address >10.0.5.1</address>

<address >127.0.0.1</address>

</ip>
<ip n="1" >
<address >10.0.1.2</address>

<address >10.0.2.1</address>

<address >10.0.3.1</address>

<address >10.0.4.1</address>

<address >10.0.5.1</address>

<address >127.0.0.1</address>

</ip>
<ip n="1" >
<address >10.0.1.2</address>

<address >10.0.2.1</address>

<address >10.0.3.1</address>

<address >10.0.4.1</address>

<address >10.0.5.1</address>

<address >127.0.0.1</address>

</ip>
<ip n="2" >
<address >10.0.2.2</address>

<address >10.0.6.1</address>

<address >127.0.0.1</address>

</ip>
<ip n="2" >
<address >10.0.2.2</address>

<address >10.0.6.1</address>

<address >127.0.0.1</address>

</ip>
<ip n="2" >
<address >10.0.2.2</address>

<address >10.0.6.1</address>

<address >127.0.0.1</address>

</ip>
<ip n="3" >
<address >10.0.3.2</address>

<address >10.0.7.1</address>

<address >127.0.0.1</address>

</ip>
<ip n="3" >
<address >10.0.3.2</address>

<address >10.0.7.1</address>

<address >127.0.0.1</address>

</ip>
<ip n="3" >
<address >10.0.3.2</address>

<address >10.0.7.1</address>

<address >127.0.0.1</address>

</ip>
<ip n="4" >
<address >10.0.4.2</address>

<address >10.0.8.1</address>

<address >127.0.0.1</address>

</ip>
<ip n="4" >
<address >10.0.4.2</address>

<address >10.0.8.1</address>

<address >127.0.0.1</address>

</ip>
<ip n="4" >
<address >10.0.4.2</address>

<address >10.0.8.1</address>

<address >127.0.0.1</address>

</ip>
<ip n="5" >
<address >10.0.5.2</address>

<address >10.0.9.1</address>

<address >127.0.0.1</address>

</ip>
<ip n="5" >
<address >10.0.5.2</address>

<address >10.0.9.1</address>

<address >127.0.0.1</address>

</ip>
<ip n="5" >
<address >10.0.5.2</address>

<address >10.0.9.1</address>

<address >127.0.0.1</address>

</ip>
<ip n="6" >
<address >10.0.6.2</address>

<address >10.0.7.2</address>

<address >10.0.8.2</address>

<address >10.0.9.2</address>

<address >10.0.10.1</address>

<address >10.0.11.1</address>

<address >10.0.12.1</address>

<address >10.0.13.1</address>

<address >127.0.0.1</address>

</ip>
<ip n="6" >
<address >10.0.6.2</address>

<address >10.0.7.2</address>

<address >10.0.8.2</address>

<address >10.0.9.2</address>

<address >10.0.10.1</address>

<address >10.0.11.1</address>

<address >10.0.12.1</address>

<address >10.0.13.1</address>

<address >127.0.0.1</address>

</ip>
<ip n="6" >
<address >10.0.6.2</address>

<address >10.0.7.2</address>

<address >10.0.8.2</address>

<address >10.0.9.2</address>

<address >10.0.10.1</address>

<address >10.0.11.1</address>

<address >10.0.12.1</address>

<address >10.0.13.1</address>

<address >127.0.0.1</address>

</ip>
<ip n="6" >
<address >10.0.6.2</address>

<address >10.0.7.2</address>

<address >10.0.8.2</address>

<address >10.0.9.2</address>

<address >10.0.10.1</address>

<address >10.0.11.1</address>

<address >10.0.12.1</address>

<address >10.0.13.1</address>

<address >127.0.0.1</address>

</ip>
<ip n="6" >
<address >10.0.6.2</address>

<address >10.0.7.2</address>

<address >10.0.8.2</address>

<address >10.0.9.2</address>

<address >10.0.10.1</address>

<address >10.0.11.1</address>

<address >10.0.12.1</address>

<address >10.0.13.1</address>

<address >127.0.0.1</address>

</ip>
<ip n="6" >
<address >10.0.6.2</address>

<address >10.0.7.2</address>

<address >10.0.8.2</address>

<address >10.0.9.2</address>

<address >10.0.10.1</address>

<address >10.0.11.1</address>

<address >10.0.12.1</address>

<address >10.0.13.1</address>

<address >127.0.0.1</address>

</ip>
<ip n="6" >
<address >10.0.6.2</address>

<address >10.0.7.2</address>

<address >10.0.8.2</address>

<address >10.0.9.2</address>

<address >10.0.10.1</address>

<address >10.0.11.1</address>

<address >10.0.12.1</address>

<address >10.0.13.1</address>

<address >127.0.0.1</address>

</ip>
<ip n="6" >
<address >10.0.6.2</address>

<address >10.0.7.2</address>

<address >10.0.8.2</address>

<address >10.0.9.2</address>

<address >10.0.10.1</address>

<address >10.0.11.1</address>

<address >10.0.12.1</address>

<address >10.0.13.1</address>

<address >127.0.0.1</address>

</ip>
<ip n="6" >
<address >10.0.6.2</address>

<address >10.0.7.2</address>

<address >10.0.8.2</address>

<address >10.0.9.2</address>

<address >10.0.10.1</address>

<address >10.0.11.1</address>

<address >10.0.12.1</address>

<address >10.0.13.1</address>

<address >127.0.0.1</address>

</ip>
<ip n="7" >
<address >10.0.10.2</address>

<address >10.0.14.1</address>

<address >127.0.0.1</address>

</ip>
<ip n="7" >
<address >10.0.10.2</address>

<address >10.0.14.1</address>

<address >127.0.0.1</address>

</ip>
<ip n="7" >
<address >10.0.10.2</address>

<address >10.0.14.1</address>

<address >127.0.0.1</address>

</ip>
<ip n="8" >
<address >10.0.11.2</address>

<address >10.0.15.1</address>

<address >127.0.0.1</address>

</ip>
<ip n="8" >
<address >10.0.11.2</address>

<address >10.0.15.1</address>

<address >127.0.0.1</address>

</ip>
<ip n="8" >
<address >10.0.11.2</address>

<address >10.0.15.1</address>

<address >127.0.0.1</address>

</ip>
<ip n="9" >
<address >10.0.12.2</address>

<address >10.0.16.1</address>

<address >127.0.0.1</address>

</ip>
<ip n="9" >
<address >10.0.12.2</address>

<address >10.0.16.1</address>

<address >127.0.0.1</address>

</ip>
<ip n="9" >
<address >10.0.12.2</address>

<address >10.0.16.1</address>

<address >127.0.0.1</address>

</ip>
<ip n="10" >
<address >10.0.13.2</address>

<address >10.0.17.1</address>

<address >127.0.0.1</address>

</ip>
<ip n="10" >
<address >10.0.13.2</address>

<address >10.0.17.1</address>

<address >127.0.0.1</address>

</ip>
<ip n="10" >
<address >10.0.13.2</address>

<address >10.0.17.1</address>

<address >127.0.0.1</address>

</ip>
<ip n="11" >
<address >10.0.14.2</address>

<address >10.0.15.2</address>

<address >10.0.16.2</address>

<address >10.0.17.2</address>

<address >10.0.18.1</address>

<address >127.0.0.1</address>

</ip>
<ip n="11" >
<address >10.0.14.2</address>

<address >10.0.15.2</address>

<address >10.0.16.2</address>

<address >10.0.17.2</address>

<address >10.0.18.1</address>

<address >127.0.0.1</address>

</ip>
<ip n="11" >
<address >10.0.14.2</address>

<address >10.0.15.2</address>

<address >10.0.16.2</address>

<address >10.0.17.2</address>

<address >10.0.18.1</address>

<address >127.0.0.1</address>

</ip>
<ip n="11" >
<address >10.0.14.2</address>

<address >10.0.15.2</address>

<address >10.0.16.2</address>

<address >10.0.17.2</address>

<address >10.0.18.1</address>

<address >127.0.0.1</address>

</ip>
<ip n="11" >
<address >10.0.14.2</address>

<address >10.0.15.2</address>

<address >10.0.16.2</address>

<address >10.0.17.2</address>

<address >10.0.18.1</address>

<address >127.0.0.1</address>

</ip>
<ip n="11" >
<address >10.0.14.2</address>

<address >10.0.15.2</address>

<address >10.0.16.2</address>

<address >10.0.17.2</address>

<address >10.0.18.1</address>

<address >127.0.0.1</address>

</ip>
<ip n="12" >
<address >10.0.18.2</address>

<address >127.0.0.1</address>

</ip>
<ip n="12" >
<address >10.0.18.2</address>

<address >127.0.0.1</address>

</ip>
<ipv6 n="0" >
<address >::1</address>

</ipv6>
<ipv6 n="1" >
<address >::1</address>

</ipv6>
<ipv6 n="2" >
<address >::1</address>

</ipv6>
<ipv6 n="3" >
<address >::1</address>

</ipv6>
<ipv6 n="4" >
<address >::1</address>

</ipv6>
<ipv6 n="5" >
<address >::1</address>

</ipv6>
<ipv6 n="6" >
<address >::1</address>

</ipv6>
<ipv6 n="7" >
<address >::1</address>

</ipv6>
<ipv6 n="8" >
<address >::1</address>

</ipv6>
<ipv6 n="9" >
<address >::1</address>

</ipv6>
<ipv6 n="10" >
<address >::1</address>

</ipv6>
<ipv6 n="11" >
<address >::1</address>

</ipv6>
<ipv6 n="12" >
<address >::1</address>

</ipv6>
<nu p="s" t="0" id="0" w="1" h="1" />
<nu p="s" t="0" id="1" w="1" h="1" />
<nu p="s" t="0" id="2" w="1" h="1" />
<nu p="s" t="0" id="3" w="1" h="1" />
<nu p="s" t="0" id="4" w="1" h="1" />
<nu p="s" t="0" id="5" w="1" h="1" />
<nu p="s" t="0" id="6" w="1" h="1" />
<nu p="s" t="0" id="7" w="1" h="1" />
<nu p="s" t="0" id="8" w="1" h="1" />
<nu p="s" t="0" id="9" w="1" h="1" />
<nu p="s" t="0" id="10" w="1" h="1" />
<nu p="s" t="0" id="11" w="1" h="1" />
<nu p="s" t="0" id="12" w="1" h="1" />
<ncs ncId="0" n="RemainingEnergy" t="DOUBLE" />
<nu p="c" t="0" id="1" r="0" g="128" b="0" />
<nu p="c" t="0" id="2" r="0" g="128" b="0" />
<nu p="c" t="0" id="3" r="0" g="128" b="0" />
<nu p="c" t="0" id="4" r="0" g="128" b="0" />
<nu p="c" t="0" id="5" r="0" g="128" b="0" />
<nu p="c" t="0" id="6" r="0" g="128" b="0" />
<nu p="c" t="0" id="7" r="0" g="128" b="0" />
<nu p="c" t="0" id="8" r="0" g="128" b="0" />
<nu p="c" t="0" id="9" r="0" g="128" b="0" />
<nu p="c" t="0" id="10" r="0" g="128" b="0" />
<nu p="c" t="0" id="11" r="0" g="128" b="0" />
<p fId="0" fbTx="1" lbTx="1.000464" meta-info="ns3::PppHeader (Point-to-Point Protocol: IP (0x0021)) ns3::Ipv4Header (tos 0x0 DSCP Default ECN Not-ECT ttl 64 id 0 protocol 6 offset (bytes) 0 flags [none] length: 56 10.0.1.1 &gt; 10.0.18.2) ns3::TcpHeader (49153 &gt; 8582 [SYN] Seq=0 Ack=0 Win=65535 ns3::TcpOptionTS(1000;0) ns3::TcpOptionWinScale(14) ns3::TcpOptionSackPermitted([sack_perm]) ns3::TcpOptionEnd(EOL))" tId="1" fbRx="1" lbRx="1.000464" />
<p fId="1" fbTx="1.000464" lbTx="1.000928" meta-info="ns3::PppHeader (Point-to-Point Protocol: IP (0x0021)) ns3::Ipv4Header (tos 0x0 DSCP Default ECN Not-ECT ttl 63 id 0 protocol 6 offset (bytes) 0 flags [none] length: 56 10.0.1.1 &gt; 10.0.18.2) ns3::TcpHeader (49153 &gt; 8582 [SYN] Seq=0 Ack=0 Win=65535 ns3::TcpOptionTS(1000;0) ns3::TcpOptionWinScale(14) ns3::TcpOptionSackPermitted([sack_perm]) ns3::TcpOptionEnd(EOL))" tId="3" fbRx="1.000464" lbRx="1.000928" />
<p fId="3" fbTx="1.000928" lbTx="1.001392" meta-info="ns3::PppHeader (Point-to-Point Protocol: IP (0x0021)) ns3::Ipv4Header (tos 0x0 DSCP Default ECN Not-ECT ttl 62 id 0 protocol 6 offset (bytes) 0 flags [none] length: 56 10.0.1.1 &gt; 10.0.18.2) ns3::TcpHeader (49153 &gt; 8582 [SYN] Seq=0 Ack=0 Win=65535 ns3::TcpOptionTS(1000;0) ns3::TcpOptionWinScale(14) ns3::TcpOptionSackPermitted([sack_perm]) ns3::TcpOptionEnd(EOL))" tId="6" fbRx="1.000928" lbRx="1.001392" />
<p fId="6" fbTx="1.001392" lbTx="1.001856" meta-info="ns3::PppHeader (Point-to-Point Protocol: IP (0x0021)) ns3::Ipv4Header (tos 0x0 DSCP Default ECN Not-ECT ttl 61 id 0 protocol 6 offset (bytes) 0 flags [none] length: 56 10.0.1.1 &gt; 10.0.18.2) ns3::TcpHeader (49153 &gt; 8582 [SYN] Seq=0 Ack=0 Win=65535 ns3::TcpOptionTS(1000;0) ns3::TcpOptionWinScale(14) ns3::TcpOptionSackPermitted([sack_perm]) ns3::TcpOptionEnd(EOL))" tId="8" fbRx="1.001392" lbRx="1.001856" />
<p fId="8" fbTx="1.001856" lbTx="1.00232" meta-info="ns3::PppHeader (Point-to-Point Protocol: IP (0x0021)) ns3::Ipv4Header (tos 0x0 DSCP Default ECN Not-ECT ttl 60 id 0 protocol 6 offset (bytes) 0 flags [none] length: 56 10.0.1.1 &gt; 10.0.18.2) ns3::TcpHeader (49153 &gt; 8582 [SYN] Seq=0 Ack=0 Win=65535 ns3::TcpOptionTS(1000;0) ns3::TcpOptionWinScale(14) ns3::TcpOptionSackPermitted([sack_perm]) ns3::TcpOptionEnd(EOL))" tId="11" fbRx="1.001856" lbRx="1.00232" />
<p fId="11" fbTx="1.00232" lbTx="1.002784" meta-info="ns3::PppHeader (Point-to-Point Protocol: IP (0x0021)) ns3::Ipv4Header (tos 0x0 DSCP Default ECN Not-ECT ttl 59 id 0 protocol 6 offset (bytes) 0 flags [none] length: 56 10.0.1.1 &gt; 10.0.18.2) ns3::TcpHeader (49153 &gt; 8582 [SYN] Seq=0 Ack=0 Win=65535 ns3::TcpOptionTS(1000;0) ns3::TcpOptionWinScale(14) ns3::TcpOptionSackPermitted([sack_perm]) ns3::TcpOptionEnd(EOL))" tId="12" fbRx="1.00232" lbRx="1.002784" />
<p fId="12" fbTx="1.002784" lbTx="1.003248" meta-info="ns3::PppHeader (Point-to-Point Protocol: IP (0x0021)) ns3::Ipv4Header (tos 0x0 DSCP Default ECN Not-ECT ttl 64 id 0 protocol 6 offset (bytes) 0 flags [none] length: 56 10.0.18.2 &gt; 10.0.1.1) ns3::TcpHeader (8582 &gt; 49153 [SYN|ACK] Seq=0 Ack=1 Win=65535 ns3::TcpOptionTS(1002;1000) ns3::TcpOptionWinScale(14) ns3::TcpOptionSackPermitted([sack_perm]) ns3::TcpOptionEnd(EOL))" tId="11" fbRx="1.002784" lbRx="1.003248" />
<p fId="11" fbTx="1.003248" lbTx="1.003712" meta-info="ns3::PppHeader (Point-to-Point Protocol: IP (0x0021)) ns3::Ipv4Header (tos 0x0 DSCP Default ECN Not-ECT ttl 63 id 0 protocol 6 offset (bytes) 0 flags [none] length: 56 10.0.18.2 &gt; 10.0.1.1) ns3::TcpHeader (8582 &gt; 49153 [SYN|ACK] Seq=0 Ack=1 Win=65535 ns3::TcpOptionTS(1002;1000) ns3::TcpOptionWinScale(14) ns3::TcpOptionSackPermitted([sack_perm]) ns3::TcpOptionEnd(EOL))" tId="8" fbRx="1.003248" lbRx="1.003712" />
<p fId="8" fbTx="1.003712" lbTx="1.004176" meta-info="ns3::PppHeader (Point-to-Point Protocol: IP (0x0021)) ns3::Ipv4Header (tos 0x0 DSCP Default ECN Not-ECT ttl 62 id 0 protocol 6 offset (bytes) 0 flags [none] length: 56 10.0.18.2 &gt; 10.0.1.1) ns3::TcpHeader (8582 &gt; 49153 [SYN|ACK] Seq=0 Ack=1 Win=65535 ns3::TcpOptionTS(1002;1000) ns3::TcpOptionWinScale(14) ns3::TcpOptionSackPermitted([sack_perm]) ns3::TcpOptionEnd(EOL))" tId="6" fbRx="1.003712" lbRx="1.004176" />
<p fId="6" fbTx="1.004176" lbTx="1.00464" meta-info="ns3::PppHeader (Point-to-Point Protocol: IP (0x0021)) ns3::Ipv4Header (tos 0x0 DSCP Default ECN Not-ECT ttl 61 id 0 protocol 6 offset (bytes) 0 flags [none] length: 56 10.0.18.2 &gt; 10.0.1.1) ns3::TcpHeader (8582 &gt; 49153 [SYN|ACK] Seq=0 Ack=1 Win=65535 ns3::TcpOptionTS(1002;1000) ns3::TcpOptionWinScale(14) ns3::TcpOptionSackPermitted([sack_perm]) ns3::TcpOptionEnd(EOL))" tId="3" fbRx="1.004176" lbRx="1.00464" />
<p fId="3" fbTx="1.00464" lbTx="1.005104" meta-info="ns3::PppHeader (Point-to-Point Protocol: IP (0x0021)) ns3::Ipv4Header (tos 0x0 DSCP Default ECN Not-ECT ttl 60 id 0 protocol 6 offset (bytes) 0 flags [none] length: 56 10.0.18.2 &gt; 10.0.1.1) ns3::TcpHeader (8582 &gt; 49153 [SYN|ACK] Seq=0 Ack=1 Win=65535 ns3::TcpOptionTS(1002;1000) ns3::TcpOptionWinScale(14) ns3::TcpOptionSackPermitted([sack_perm]) ns3::TcpOptionEnd(EOL))" tId="1" fbRx="1.00464" lbRx="1.005104" />
<p fId="1" fbTx="1.005104" lbTx="1.005568" meta-info="ns3::PppHeader (Point-to-Point Protocol: IP (0x0021)) ns3::Ipv4Header (tos 0x0 DSCP Default ECN Not-ECT ttl 59 id 0 protocol 6 offset (bytes) 0 flags [none] length: 56 10.0.18.2 &gt; 10.0.1.1) ns3::TcpHeader (8582 &gt; 49153 [SYN|ACK] Seq=0 Ack=1 Win=65535 ns3::TcpOptionTS(1002;1000) ns3::TcpOptionWinScale(14) ns3::TcpOptionSackPermitted([sack_perm]) ns3::TcpOptionEnd(EOL))" tId="0" fbRx="1.005104" lbRx="1.005568" />
<p fId="0" fbTx="1.005568" lbTx="1.005999999" meta-info="ns3::PppHeader (Point-to-Point Protocol: IP (0x0021)) ns3::Ipv4Header (tos 0x0 DSCP Default ECN Not-ECT ttl 64 id 1 protocol 6 offset (bytes) 0 flags [none] length: 52 10.0.1.1 &gt; 10.0.18.2) ns3::TcpHeader (49153 &gt; 8582 [ACK] Seq=1 Ack=1 Win=65535 ns3::TcpOptionTS(1005;1002) ns3::TcpOptionEnd(EOL))" tId="1" fbRx="1.005568" lbRx="1.005999999" />
<p fId="0" fbTx="1.005999999" lbTx="1.010719999" meta-info="ns3::PppHeader (Point-to-Point Protocol: IP (0x0021)) ns3::Ipv4Header (tos 0x0 DSCP Default ECN Not-ECT ttl 64 id 2 protocol 6 offset (bytes) 0 flags [none] length: 588 10.0.1.1 &gt; 10.0.18.2) ns3::TcpHeader (49153 &gt; 8582 [ACK] Seq=1 Ack=1 Win=65535 ns3::TcpOptionTS(1005;1002) ns3::TcpOptionEnd(EOL)) Payload Fragment [0:536]" tId="1" fbRx="1.005999999" lbRx="1.010719999" />
<p fId="1" fbTx="1.005999999" lbTx="1.006431998" meta-info="ns3::PppHeader (Point-to-Point Protocol: IP (0x0021)) ns3::Ipv4Header (tos 0x0 DSCP Default ECN Not-ECT ttl 63 id 1 protocol 6 offset (bytes) 0 flags [none] length: 52 10.0.1.1 &gt; 10.0.18.2) ns3::TcpHeader (49153 &gt; 8582 [ACK] Seq=1 Ack=1 Win=65535 ns3::TcpOptionTS(1005;1002) ns3::TcpOptionEnd(EOL))" tId="2" fbRx="1.005999999" lbRx="1.006431998" />
<p fId="2" fbTx="1.006431998" lbTx="1.006863997" meta-info="ns3::PppHeader (Point-to-Point Protocol: IP (0x0021)) ns3::Ipv4Header (tos 0x0 DSCP Default ECN Not-ECT ttl 62 id 1 protocol 6 offset (bytes) 0 flags [none] length: 52 10.0.1.1 &gt; 10.0.18.2) ns3::TcpHeader (49153 &gt; 8582 [ACK] Seq=1 Ack=1 Win=65535 ns3::TcpOptionTS(1005;1002) ns3::TcpOptionEnd(EOL))" tId="6" fbRx="1.006431998" lbRx="1.006863997" />
<p fId="6" fbTx="1.006863997" lbTx="1.007295996" meta-info="ns3::PppHeader (Point-to-Point Protocol: IP (0x0021)) ns3::Ipv4Header (tos 0x0 DSCP Default ECN Not-ECT ttl 61 id 1 protocol 6 offset (bytes) 0 flags [none] length: 52 10.0.1.1 &gt; 10.0.18.2) ns3::TcpHeader (49153 &gt; 8582 [ACK] Seq=1 Ack=1 Win=65535 ns3::TcpOptionTS(1005;1002) ns3::TcpOptionEnd(EOL))" tId="10" fbRx="1.006863997" lbRx="1.007295996" />
<p fId="10" fbTx="1.007295996" lbTx="1.007727995" meta-info="ns3::PppHeader (Point-to-Point Protocol: IP (0x0021)) ns3::Ipv4Header (tos 0x0 DSCP Default ECN Not-ECT ttl 60 id 1 protocol 6 offset (bytes) 0 flags [none] length: 52 10.0.1.1 &gt; 10.0.18.2) ns3::TcpHeader (49153 &gt; 8582 [ACK] Seq=1 Ack=1 Win=65535 ns3::TcpOptionTS(1005;1002) ns3::TcpOptionEnd(EOL))" tId="11" fbRx="1.007295996" lbRx="1.007727995" />
<p fId="11" fbTx="1.007727995" lbTx="1.008159994" meta-info="ns3::PppHeader (Point-to-Point Protocol: IP (0x0021)) ns3::Ipv4Header (tos 0x0 DSCP Default ECN Not-ECT ttl 59 id 1 protocol 6 offset (bytes) 0 flags [none] length: 52 10.0.1.1 &gt; 10.0.18.2) ns3::TcpHeader (49153 &gt; 8582 [ACK] Seq=1 Ack=1 Win=65535 ns3::TcpOptionTS(1005;1002) ns3::TcpOptionEnd(EOL))" tId="12" fbRx="1.007727995" lbRx="1.008159994" />
<p fId="1" fbTx="1.010719999" lbTx="1.015439999" meta-info="ns3::PppHeader (Point-to-Point Protocol: IP (0x0021)) ns3::Ipv4Header (tos 0x0 DSCP Default ECN Not-ECT ttl 63 id 2 protocol 6 offset (bytes) 0 flags [none] length: 588 10.0.1.1 &gt; 10.0.18.2) ns3::TcpHeader (49153 &gt; 8582 [ACK] Seq=1 Ack=1 Win=65535 ns3::TcpOptionTS(1005;1002) ns3::TcpOptionEnd(EOL)) Payload Fragment [0:536]" tId="3" fbRx="1.010719999" lbRx="1.015439999" />
<p fId="3" fbTx="1.015439999" lbTx="1.020159999" meta-info="ns3::PppHeader (Point-to-Point Protocol: IP (0x0021)) ns3::Ipv4Header (tos 0x0 DSCP Default ECN Not-ECT ttl 62 id 2 protocol 6 offset (bytes) 0 flags [none] length: 588 10.0.1.1 &gt; 10.0.18.2) ns3::TcpHeader (49153 &gt; 8582 [ACK] Seq=1 Ack=1 Win=65535 ns3::TcpOptionTS(1005;1002) ns3::TcpOptionEnd(EOL)) Payload Fragment [0:536]" tId="6" fbRx="1.015439999" lbRx="1.020159999" />
<p fId="6" fbTx="1.020159999" lbTx="1.024879999" meta-info="ns3::PppHeader (Point-to-Point Protocol: IP (0x0021)) ns3::Ipv4Header (tos 0x0 DSCP Default ECN Not-ECT ttl 61 id 2 protocol 6 offset (bytes) 0 flags [none] length: 588 10.0.1.1 &gt; 10.0.18.2) ns3::TcpHeader (49153 &gt; 8582 [ACK] Seq=1 Ack=1 Win=65535 ns3::TcpOptionTS(1005;1002) ns3::TcpOptionEnd(EOL)) Payload Fragment [0:536]" tId="10" fbRx="1.020159999" lbRx="1.024879999" />
<p fId="10" fbTx="1.024879999" lbTx="1.029599999" meta-info="ns3::PppHeader (Point-to-Point Protocol: IP (0x0021)) ns3::Ipv4Header (tos 0x0 DSCP Default ECN Not-ECT ttl 60 id 2 protocol 6 offset (bytes) 0 flags [none] length: 588 10.0.1.1 &gt; 10.0.18.2) ns3::TcpHeader (49153 &gt; 8582 [ACK] Seq=1 Ack=1 Win=65535 ns3::TcpOptionTS(1005;1002) ns3::TcpOptionEnd(EOL)) Payload Fragment [0:536]" tId="11" fbRx="1.024879999" lbRx="1.029599999" />
<p fId="11" fbTx="1.029599999" lbTx="1.034319999" meta-info="ns3::PppHeader (Point-to-Point Protocol: IP (0x0021)) ns3::Ipv4Header (tos 0x0 DSCP Default ECN Not-ECT ttl 59 id 2 protocol 6 offset (bytes) 0 flags [none] length: 588 10.0.1.1 &gt; 10.0.18.2) ns3::TcpHeader (49153 &gt; 8582 [ACK] Seq=1 Ack=1 Win=65535 ns3::TcpOptionTS(1005;1002) ns3::TcpOptionEnd(EOL)) Payload Fragment [0:536]" tId="12" fbRx="1.029599999" lbRx="1.034319999" />
<p fId="12" fbTx="1.034319999" lbTx="1.034751998" meta-info="ns3::PppHeader (Point-to-Point Protocol: IP (0x0021)) ns3::Ipv4Header (tos 0x0 DSCP Default ECN Not-ECT ttl 64 id 1 protocol 6 offset (bytes) 0 flags [none] length: 52 10.0.18.2 &gt; 10.0.1.1) ns3::TcpHeader (8582 &gt; 49153 [ACK] Seq=1 Ack=537 Win=65535 ns3::TcpOptionTS(1034;1005) ns3::TcpOptionEnd(EOL))" tId="11" fbRx="1.034319999" lbRx="1.034751998" />
<p fId="11" fbTx="1.034751998" lbTx="1.035183997" meta-info="ns3::PppHeader (Point-to-Point Protocol: IP (0x0021)) ns3::Ipv4Header (tos 0x0 DSCP Default ECN Not-ECT ttl 63 id 1 protocol 6 offset (bytes) 0 flags [none] length: 52 10.0.18.2 &gt; 10.0.1.1) ns3::TcpHeader (8582 &gt; 49153 [ACK] Seq=1 Ack=537 Win=65535 ns3::TcpOptionTS(1034;1005) ns3::TcpOptionEnd(EOL))" tId="9" fbRx="1.034751998" lbRx="1.035183997" />
<p fId="9" fbTx="1.035183997" lbTx="1.035615996" meta-info="ns3::PppHeader (Point-to-Point Protocol: IP (0x0021)) ns3::Ipv4Header (tos 0x0 DSCP Default ECN Not-ECT ttl 62 id 1 protocol 6 offset (bytes) 0 flags [none] length: 52 10.0.18.2 &gt; 10.0.1.1) ns3::TcpHeader (8582 &gt; 49153 [ACK] Seq=1 Ack=537 Win=65535 ns3::TcpOptionTS(1034;1005) ns3::TcpOptionEnd(EOL))" tId="6" fbRx="1.035183997" lbRx="1.035615996" />
<p fId="6" fbTx="1.035615996" lbTx="1.036047995" meta-info="ns3::PppHeader (Point-to-Point Protocol: IP (0x0021)) ns3::Ipv4Header (tos 0x0 DSCP Default ECN Not-ECT ttl 61 id 1 protocol 6 offset (bytes) 0 flags [none] length: 52 10.0.18.2 &gt; 10.0.1.1) ns3::TcpHeader (8582 &gt; 49153 [ACK] Seq=1 Ack=537 Win=65535 ns3::TcpOptionTS(1034;1005) ns3::TcpOptionEnd(EOL))" tId="3" fbRx="1.035615996" lbRx="1.036047995" />
<p fId="3" fbTx="1.036047995" lbTx="1.036479994" meta-info="ns3::PppHeader (Point-to-Point Protocol: IP (0x0021)) ns3::Ipv4Header (tos 0x0 DSCP Default ECN Not-ECT ttl 60 id 1 protocol 6 offset (bytes) 0 flags [none] length: 52 10.0.18.2 &gt; 10.0.1.1) ns3::TcpHeader (8582 &gt; 49153 [ACK] Seq=1 Ack=537 Win=65535 ns3::TcpOptionTS(1034;1005) ns3::TcpOptionEnd(EOL))" tId="1" fbRx="1.036047995" lbRx="1.036479994" />
<p fId="1" fbTx="1.036479994" lbTx="1.036911993" meta-info="ns3::PppHeader (Point-to-Point Protocol: IP (0x0021)) ns3::Ipv4Header (tos 0x0 DSCP Default ECN Not-ECT ttl 59 id 1 protocol 6 offset (bytes) 0 flags [none] length: 52 10.0.18.2 &gt; 10.0.1.1) ns3::TcpHeader (8582 &gt; 49153 [ACK] Seq=1 Ack=537 Win=65535 ns3::TcpOptionTS(1034;1005) ns3::TcpOptionEnd(EOL))" tId="0" fbRx="1.036479994" lbRx="1.036911993" />
<p fId="0" fbTx="1.036911993" lbTx="1.041631993" meta-info="ns3::PppHeader (Point-to-Point Protocol: IP (0x0021)) ns3::Ipv4Header (tos 0x0 DSCP Default ECN Not-ECT ttl 64 id 3 protocol 6 offset (bytes) 0 flags [none] length: 588 10.0.1.1 &gt; 10.0.18.2) ns3::TcpHeader (49153 &gt; 8582 [ACK] Seq=537 Ack=1 Win=65535 ns3::TcpOptionTS(1036;1034) ns3::TcpOptionEnd(EOL)) Payload Fragment [536:1072]" tId="1" fbRx="1.036911993" lbRx="1.041631993" />
<p fId="0" fbTx="1.041631993" lbTx="1.046351993" meta-info="ns3::PppHeader (Point-to-Point Protocol: IP (0x0021)) ns3::Ipv4Header (tos 0x0 DSCP Default ECN Not-ECT ttl 64 id 4 protocol 6 offset (bytes) 0 flags [none] length: 588 10.0.1.1 &gt; 10.0.18.2) ns3::TcpHeader (49153 &gt; 8582 [ACK] Seq=1073 Ack=1 Win=65535 ns3::TcpOptionTS(1036;1034) ns3::TcpOptionEnd(EOL)) Payload Fragment [1072:1440] Payload Fragment [0:168]" tId="1" fbRx="1.041631993" lbRx="1.046351993" />
<p fId="1" fbTx="1.041631993" lbTx="1.046351993" meta-info="ns3::PppHeader (Point-to-Point Protocol: IP (0x0021)) ns3::Ipv4Header (tos 0x0 DSCP Default ECN Not-ECT ttl 63 id 3 protocol 6 offset (bytes) 0 flags [none] length: 588 10.0.1.1 &gt; 10.0.18.2) ns3::TcpHeader (49153 &gt; 8582 [ACK] Seq=537 Ack=1 Win=65535 ns3::TcpOptionTS(1036;1034) ns3::TcpOptionEnd(EOL)) Payload Fragment [536:1072]" tId="2" fbRx="1.041631993" lbRx="1.046351993" />
<p fId="1" fbTx="1.046351993" lbTx="1.051071993" meta-info="ns3::PppHeader (Point-to-Point Protocol: IP (0x0021)) ns3::Ipv4Header (tos 0x0 DSCP Default ECN Not-ECT ttl 63 id 4 protocol 6 offset (bytes) 0 flags [none] length: 588 10.0.1.1 &gt; 10.0.18.2) ns3::TcpHeader (49153 &gt; 8582 [ACK] Seq=1073 Ack=1 Win=65535 ns3::TcpOptionTS(1036;1034) ns3::TcpOptionEnd(EOL)) Payload Fragment [1072:1440] Payload Fragment [0:168]" tId="5" fbRx="1.046351993" lbRx="1.051071993" />
<p fId="2" fbTx="1.046351993" lbTx="1.051071993" meta-info="ns3::PppHeader (Point-to-Point Protocol: IP (0x0021)) ns3::Ipv4Header (tos 0x0 DSCP Default ECN Not-ECT ttl 62 id 3 protocol 6 offset (bytes) 0 flags [none] length: 588 10.0.1.1 &gt; 10.0.18.2) ns3::TcpHeader (49153 &gt; 8582 [ACK] Seq=537 Ack=1 Win=65535 ns3::TcpOptionTS(1036;1034) ns3::TcpOptionEnd(EOL)) Payload Fragment [536:1072]" tId="6" fbRx="1.046351993" lbRx="1.051071993" />
<p fId="5" fbTx="1.051071993" lbTx="1.055791993" meta-info="ns3::PppHeader (Point-to-Point Protocol: IP (0x0021)) ns3::Ipv4Header (tos 0x0 DSCP Default ECN Not-ECT ttl 62 id 4 protocol 6 offset (bytes) 0 flags [none] length: 588 10.0.1.1 &gt; 10.0.18.2) ns3::TcpHeader (49153 &gt; 8582 [ACK] Seq=1073 Ack=1 Win=65535 ns3::TcpOptionTS(1036;1034) ns3::TcpOptionEnd(EOL)) Payload Fragment [1072:1440] Payload Fragment [0:168]" tId="6" fbRx="1.051071993" lbRx="1.055791993" />
<p fId="6" fbTx="1.051071993" lbTx="1.055791993" meta-info="ns3::PppHeader (Point-to-Point Protocol: IP (0x0021)) ns3::Ipv4Header (tos 0x0 DSCP Default ECN Not-ECT ttl 61 id 3 protocol 6 offset (bytes) 0 flags [none] length: 588 10.0.1.1 &gt; 10.0.18.2) ns3::TcpHeader (49153 &gt; 8582 [ACK] Seq=537 Ack=1 Win=65535 ns3::TcpOptionTS(1036;1034) ns3::TcpOptionEnd(EOL)) Payload Fragment [536:1072]" tId="9" fbRx="1.051071993" lbRx="1.055791993" />
<p fId="6" fbTx="1.055791993" lbTx="1.060511993" meta-info="ns3::PppHeader (Point-to-Point Protocol: IP (0x0021)) ns3::Ipv4Header (tos 0x0 DSCP Default ECN Not-ECT ttl 61 id 4 protocol 6 offset (bytes) 0 flags [none] length: 588 10.0.1.1 &gt; 10.0.18.2) ns3::TcpHeader (49153 &gt; 8582 [ACK] Seq=1073 Ack=1 Win=65535 ns3::TcpOptionTS(1036;1034) ns3::TcpOptionEnd(EOL)) Payload Fragment [1072:1440] Payload Fragment [0:168]" tId="9" fbRx="1.055791993" lbRx="1.060511993" />
<p fId="9" fbTx="1.055791993" lbTx="1.060511993" meta-info="ns3::PppHeader (Point-to-Point Protocol: IP (0x0021)) ns3::Ipv4Header (tos 0x0 DSCP Default ECN Not-ECT ttl 60 id 3 protocol 6 offset (bytes) 0 flags [none] length: 588 10.0.1.1 &gt; 10.0.18.2) ns3::TcpHeader (49153 &gt; 8582 [ACK] Seq=537 Ack=1 Win=65535 ns3::TcpOptionTS(1036;1034) ns3::TcpOptionEnd(EOL)) Payload Fragment [536:1072]" tId="11" fbRx="1.055791993" lbRx="1.060511993" />
<p fId="9" fbTx="1.060511993" lbTx="1.065231993" meta-info="ns3::PppHeader (Point-to-Point Protocol: IP (0x0021)) ns3::Ipv4Header (tos 0x0 DSCP Default ECN Not-ECT ttl 60 id 4 protocol 6 offset (bytes) 0 flags [none] length: 588 10.0.1.1 &gt; 10.0.18.2) ns3::TcpHeader (49153 &gt; 8582 [ACK] Seq=1073 Ack=1 Win=65535 ns3::TcpOptionTS(1036;1034) ns3::TcpOptionEnd(EOL)) Payload Fragment [1072:1440] Payload Fragment [0:168]" tId="11" fbRx="1.060511993" lbRx="1.065231993" />
<p fId="11" fbTx="1.060511993" lbTx="1.065231993" meta-info="ns3::PppHeader (Point-to-Point Protocol: IP (0x0021)) ns3::Ipv4Header (tos 0x0 DSCP Default ECN Not-ECT ttl 59 id 3 protocol 6 offset (bytes) 0 flags [none] length: 588 10.0.1.1 &gt; 10.0.18.2) ns3::TcpHeader (49153 &gt; 8582 [ACK] Seq=537 Ack=1 Win=65535 ns3::TcpOptionTS(1036;1034) ns3::TcpOptionEnd(EOL)) Payload Fragment [536:1072]" tId="12" fbRx="1.060511993" lbRx="1.065231993" />
<p fId="11" fbTx="1.065231993" lbTx="1.069951993" meta-info="ns3::PppHeader (Point-to-Point Protocol: IP (0x0021)) ns3::Ipv4Header (tos 0x0 DSCP Default ECN Not-ECT ttl 59 id 4 protocol 6 offset (bytes) 0 flags [none] length: 588 10.0.1.1 &gt; 10.0.18.2) ns3::TcpHeader (49153 &gt; 8582 [ACK] Seq=1073 Ack=1 Win=65535 ns3::TcpOptionTS(1036;1034) ns3::TcpOptionEnd(EOL)) Payload Fragment [1072:1440] Payload Fragment [0:168]" tId="12" fbRx="1.065231993" lbRx="1.069951993" />
<p fId="12" fbTx="1.069951993" lbTx="1.070383992" meta-info="ns3::PppHeader (Point-to-Point Protocol: IP (0x0021)) ns3::Ipv4Header (tos 0x0 DSCP Default ECN Not-ECT ttl 64 id 2 protocol 6 offset (bytes) 0 flags [none] length: 52 10.0.18.2 &gt; 10.0.1.1) ns3::TcpHeader (8582 &gt; 49153 [ACK] Seq=1 Ack=1609 Win=65535 ns3::TcpOptionTS(1069;1036) ns3::TcpOptionEnd(EOL))" tId="11" fbRx="1.069951993" lbRx="1.070383992" />
<p fId="11" fbTx="1.070383992" lbTx="1.070815991" meta-info="ns3::PppHeader (Point-to-Point Protocol: IP (0x0021)) ns3::Ipv4Header (tos 0x0 DSCP Default ECN Not-ECT ttl 63 id 2 protocol 6 offset (bytes) 0 flags [none] length: 52 10.0.18.2 &gt; 10.0.1.1) ns3::TcpHeader (8582 &gt; 49153 [ACK] Seq=1 Ack=1609 Win=65535 ns3::TcpOptionTS(1069;1036) ns3::TcpOptionEnd(EOL))" tId="9" fbRx="1.070383992" lbRx="1.070815991" />
<p fId="9" fbTx="1.070815991" lbTx="1.07124799" meta-info="ns3::PppHeader (Point-to-Point Protocol: IP (0x0021)) ns3::Ipv4Header (tos 0x0 DSCP Default ECN Not-ECT ttl 62 id 2 protocol 6 offset (bytes) 0 flags [none] length: 52 10.0.18.2 &gt; 10.0.1.1) ns3::TcpHeader (8582 &gt; 49153 [ACK] Seq=1 Ack=1609 Win=65535 ns3::TcpOptionTS(1069;1036) ns3::TcpOptionEnd(EOL))" tId="6" fbRx="1.070815991" lbRx="1.07124799" />
<p fId="6" fbTx="1.07124799" lbTx="1.071679989" meta-info="ns3::PppHeader (Point-to-Point Protocol: IP (0x0021)) ns3::Ipv4Header (tos 0x0 DSCP Default ECN Not-ECT ttl 61 id 2 protocol 6 offset (bytes) 0 flags [none] length: 52 10.0.18.2 &gt; 10.0.1.1) ns3::TcpHeader (8582 &gt; 49153 [ACK] Seq=1 Ack=1609 Win=65535 ns3::TcpOptionTS(1069;1036) ns3::TcpOptionEnd(EOL))" tId="3" fbRx="1.07124799" lbRx="1.071679989" />
<p fId="3" fbTx="1.071679989" lbTx="1.072111988" meta-info="ns3::PppHeader (Point-to-Point Protocol: IP (0x0021)) ns3::Ipv4Header (tos 0x0 DSCP Default ECN Not-ECT ttl 60 id 2 protocol 6 offset (bytes) 0 flags [none] length: 52 10.0.18.2 &gt; 10.0.1.1) ns3::TcpHeader (8582 &gt; 49153 [ACK] Seq=1 Ack=1609 Win=65535 ns3::TcpOptionTS(1069;1036) ns3::TcpOptionEnd(EOL))" tId="1" fbRx="1.071679989" lbRx="1.072111988" />
<p fId="1" fbTx="1.072111988" lbTx="1.072543987" meta-info="ns3::PppHeader (Point-to-Point Protocol: IP (0x0021)) ns3::Ipv4Header (tos 0x0 DSCP Default ECN Not-ECT ttl 59 id 2 protocol 6 offset (bytes) 0 flags [none] length: 52 10.0.18.2 &gt; 10.0.1.1) ns3::TcpHeader (8582 &gt; 49153 [ACK] Seq=1 Ack=1609 Win=65535 ns3::TcpOptionTS(1069;1036) ns3::TcpOptionEnd(EOL))" tId="0" fbRx="1.072111988" lbRx="1.072543987" />
<p fId="0" fbTx="1.072543987" lbTx="1.077263987" meta-info="ns3::PppHeader (Point-to-Point Protocol: IP (0x0021)) ns3::Ipv4Header (tos 0x0 DSCP Default ECN Not-ECT ttl 64 id 5 protocol 6 offset (bytes) 0 flags [none] length: 588 10.0.1.1 &gt; 10.0.18.2) ns3::TcpHeader (49153 &gt; 8582 [ACK] Seq=1609 Ack=1 Win=65535 ns3::TcpOptionTS(1072;1069) ns3::TcpOptionEnd(EOL)) Payload Fragment [168:704]" tId="1" fbRx="1.072543987" lbRx="1.077263987" />
<p fId="0" fbTx="1.077263987" lbTx="1.081983987" meta-info="ns3::PppHeader (Point-to-Point Protocol: IP (0x0021)) ns3::Ipv4Header (tos 0x0 DSCP Default ECN Not-ECT ttl 64 id 6 protocol 6 offset (bytes) 0 flags [none] length: 588 10.0.1.1 &gt; 10.0.18.2) ns3::TcpHeader (49153 &gt; 8582 [ACK] Seq=2145 Ack=1 Win=65535 ns3::TcpOptionTS(1072;1069) ns3::TcpOptionEnd(EOL)) Payload Fragment [704:1240]" tId="1" fbRx="1.077263987" lbRx="1.081983987" />
<p fId="1" fbTx="1.077263987" lbTx="1.081983987" meta-info="ns3::PppHeader (Point-to-Point Protocol: IP (0x0021)) ns3::Ipv4Header (tos 0x0 DSCP Default ECN Not-ECT ttl 63 id 5 protocol 6 offset (bytes) 0 flags [none] length: 588 10.0.1.1 &gt; 10.0.18.2) ns3::TcpHeader (49153 &gt; 8582 [ACK] Seq=1609 Ack=1 Win=65535 ns3::TcpOptionTS(1072;1069) ns3::TcpOptionEnd(EOL)) Payload Fragment [168:704]" tId="5" fbRx="1.077263987" lbRx="1.081983987" />
<p fId="0" fbTx="1.081983987" lbTx="1.086703987" meta-info="ns3::PppHeader (Point-to-Point Protocol: IP (0x0021)) ns3::Ipv4Header (tos 0x0 DSCP Default ECN Not-ECT ttl 64 id 7 protocol 6 offset (bytes) 0 flags [none] length: 588 10.0.1.1 &gt; 10.0.18.2) ns3::TcpHeader (49153 &gt; 8582 [ACK] Seq=2681 Ack=1 Win=65535 ns3::TcpOptionTS(1072;1069) ns3::TcpOptionEnd(EOL)) Payload Fragment [1240:1440] Payload Fragment [0:336]" tId="1" fbRx="1.081983987" lbRx="1.086703987" />
<p fId="1" fbTx="1.081983987" lbTx="1.086703987" meta-info="ns3::PppHeader (Point-to-Point Protocol: IP (0x0021)) ns3::Ipv4Header (tos 0x0 DSCP Default ECN Not-ECT ttl 63 id 6 protocol 6 offset (bytes) 0 flags [none] length: 588 10.0.1.1 &gt; 10.0.18.2) ns3::TcpHeader (49153 &gt; 8582 [ACK] Seq=2145 Ack=1 Win=65535 ns3::TcpOptionTS(1072;1069) ns3::TcpOptionEnd(EOL)) Payload Fragment [704:1240]" tId="4" fbRx="1.081983987" lbRx="1.086703987" />
<p fId="5" fbTx="1.081983987" lbTx="1.086703987" meta-info="ns3::PppHeader (Point-to-Point Protocol: IP (0x0021)) ns3::Ipv4Header (tos 0x0 DSCP Default ECN Not-ECT ttl 62 id 5 protocol 6 offset (bytes) 0 flags [none] length: 588 10.0.1.1 &gt; 10.0.18.2) ns3::TcpHeader (49153 &gt; 8582 [ACK] Seq=1609 Ack=1 Win=65535 ns3::TcpOptionTS(1072;1069) ns3::TcpOptionEnd(EOL)) Payload Fragment [168:704]" tId="6" fbRx="1.081983987" lbRx="1.086703987" />
<p fId="1" fbTx="1.086703987" lbTx="1.091423987" meta-info="ns3::PppHeader (Point-to-Point Protocol: IP (0x0021)) ns3::Ipv4Header (tos 0x0 DSCP Default ECN Not-ECT ttl 63 id 7 protocol 6 offset (bytes) 0 flags [none] length: 588 10.0.1.1 &gt; 10.0.18.2) ns3::TcpHeader (49153 &gt; 8582 [ACK] Seq=2681 Ack=1 Win=65535 ns3::TcpOptionTS(1072;1069) ns3::TcpOptionEnd(EOL)) Payload Fragment [1240:1440] Payload Fragment [0:336]" tId="2" fbRx="1.086703987" lbRx="1.091423987" />
<p fId="4" fbTx="1.086703987" lbTx="1.091423987" meta-info="ns3::PppHeader (Point-to-Point Protocol: IP (0x0021)) ns3::Ipv4Header (tos 0x0 DSCP Default ECN Not-ECT ttl 62 id 6 protocol 6 offset (bytes) 0 flags [none] length: 588 10.0.1.1 &gt; 10.0.18.2) ns3::TcpHeader (49153 &gt; 8582 [ACK] Seq=2145 Ack=1 Win=65535 ns3::TcpOptionTS(1072;1069) ns3::TcpOptionEnd(EOL)) Payload Fragment [704:1240]" tId="6" fbRx="1.086703987" lbRx="1.091423987" />
<p fId="6" fbTx="1.086703987" lbTx="1.091423987" meta-info="ns3::PppHeader (Point-to-Point Protocol: IP (0x0021)) ns3::Ipv4Header (tos 0x0 DSCP Default ECN Not-ECT ttl 61 id 5 protocol 6 offset (bytes) 0 flags [none] length: 588 10.0.1.1 &gt; 10.0.18.2) ns3::TcpHeader (49153 &gt; 8582 [ACK] Seq=1609 Ack=1 Win=65535 ns3::TcpOptionTS(1072;1069) ns3::TcpOptionEnd(EOL)) Payload Fragment [168:704]" tId="7" fbRx="1.086703987" lbRx="1.091423987" />
<p fId="2" fbTx="1.091423987" lbTx="1.096143987" meta-info="ns3::PppHeader (Point-to-Point Protocol: IP (0x0021)) ns3::Ipv4Header (tos 0x0 DSCP Default ECN Not-ECT ttl 62 id 7 protocol 6 offset (bytes) 0 flags [none] length: 588 10.0.1.1 &gt; 10.0.18.2) ns3::TcpHeader (49153 &gt; 8582 [ACK] Seq=2681 Ack=1 Win=65535 ns3::TcpOptionTS(1072;1069) ns3::TcpOptionEnd(EOL)) Payload Fragment [1240:1440] Payload Fragment [0:336]" tId="6" fbRx="1.091423987" lbRx="1.096143987" />
